{
  "delegation_id": "dae-revoked-001",
  "principal": "OrgA.AgentA",
  "delegate": "OrgA.AgentB",
  "allowed_actions": ["purchase_order.create"],
  "constraints": {
    "max_value": 10000,
    "currency": "EUR",
    "jurisdiction": "EU"
  },
  "expiry": "2030-01-01T00:00:00Z",
  "revocable": true,
  "revoked": true,
  "audit_required": true
}
